{
  "schema_version": "pywel.publication_contract.v1",
  "contract_id": "pywel-publication-boundary-v1",
  "allowed_source_schemes": [
    "https:"
  ],
  "public_docs": [
    "API_V1.md",
    "ARCHITECTURE.md",
    "COMPATIBILITY.md",
    "DATA_MODEL.md",
    "M1_COMPLETION.md",
    "M2_COMPLETION.md",
    "M3_COMPLETION.md",
    "M4_COMPLETION.md",
    "M5_COMPLETION.md",
    "OPERATIONS.md",
    "PORTABILITY.md",
    "RELEASE_SCOPE.md",
    "ROADMAP_TO_1_0.md",
    "SOURCE_POLICY.md",
    "THREAT_MODEL.md",
    "M7_HOUSE_ROBERTS.md",
    "M8A_PROGRESSION.md",
    "M8B_EQUIPMENT.md",
    "S01_EQUIPMENT_POPULATION.md",
    "S02_ACQUISITION.md",
    "S03_RECIPE_INPUTS.md",
    "S04_RECIPE_OUTPUTS.md",
    "S05_QUEST_REWARDS.md",
    "G04_CURRENT_PATCH.md"
  ],
  "public_schemas": [
    "agent-contract.schema.json",
    "build-manifest.schema.json",
    "claim-catalog.schema.json",
    "claim.schema.json",
    "common.schema.json",
    "corpus.schema.json",
    "entity-catalog.schema.json",
    "entity-subtype-registry.schema.json",
    "entity.schema.json",
    "evidence-catalog.schema.json",
    "evidence.schema.json",
    "patch-catalog.schema.json",
    "patch.schema.json",
    "predicate-registry.schema.json",
    "public-release-scope-v2.schema.json",
    "publication-contract.schema.json",
    "receipt.schema.json",
    "source-snapshot.schema.json",
    "strategy-catalog.schema.json",
    "strategy.schema.json",
    "corpus-additions.schema.json"
  ]
}
